<?xml version="1.0" encoding="UTF-8"?>
<etapa xmlns="http://www.uniovi.es"
       xmlns:xsi="http://www.w3.org/2001/XMLSchema-instance"
       xsi:schemaLocation="http://www.uniovi.es etapa.xsd">
    
    <!-- Datos de la etapa -->
   <nombre>Cartagena - Lorca</nombre>
    <numero>11</numero>
    <tipo>llana</tipo>
    <fecha>2026-09-02</fecha>
    <longitud unidad="km">153.8</longitud>
    <desnivel unidad="m">1351</desnivel>
    <ciudad_salida>Cartagena</ciudad_salida>
    <ciudad_llegada>Lorca</ciudad_llegada>
    <tiempo_ganador>03:30:00</tiempo_ganador>
    <velocidad_media_ganador unidad="km/h">43.9</velocidad_media_ganador>

    <referencias>
        <referencia>https://www.lavuelta.es/</referencia>
        <referencia>https://cartagena.es/</referencia>
        <referencia>https://lorca.es/</referencia>
    </referencias>

    <galeria_fotografias>
        <fotografia>multimedia/salida.jpg</fotografia>
        <fotografia>multimedia/llegada.jpg</fotografia>
    </galeria_fotografias>

    <galeria_videos>
        <video>multimedia/resumenetapa.mp4</video>
    </galeria_videos>

    <galeria_sonidos>
        <audio>multimedia/resumenetapa.mp3</audio>
    </galeria_sonidos>

    <coordenadas_salida>
        <longitud_geo unidad="grados">-0.9769</longitud_geo>
        <latitud_geo unidad="grados">37.5994</latitud_geo>
        <altitud unidad="m">39.0</altitud>
    </coordenadas_salida>

    <coordenadas_llegada>
        <longitud_geo unidad="grados">-1.7045</longitud_geo>
        <latitud_geo unidad="grados">37.6601</latitud_geo>
        <altitud unidad="m">337.0</altitud>
    </coordenadas_llegada>

    <hitos>
        <hito>
            <nombre_hito>Sprint Intermedio Totana</nombre_hito>
            <tipo_hito>Sprint intermedio</tipo_hito>
            <distancia_salida unidad="km">111.9</distancia_salida>
            <longitud_geo unidad="grados">-1.4981</longitud_geo>
            <latitud_geo unidad="grados">37.7706</latitud_geo>
            <altitud unidad="m">225.0</altitud>
        </hito>
        <hito>
            <nombre_hito>Alto de Aledo</nombre_hito>
            <tipo_hito>Puerto de montaña 3ª categoría</tipo_hito>
            <distancia_salida unidad="km">121.8</distancia_salida>
            <longitud_geo unidad="grados">-1.5739</longitud_geo>
            <latitud_geo unidad="grados">37.7944</latitud_geo>
            <altitud unidad="m">623.0</altitud>
        </hito>
    </hitos>

    <puntos_anonimos>
        <punto>
            <distancia_salida unidad="km">48.5</distancia_salida>
            <longitud_geo unidad="grados">-0.9664</longitud_geo>
            <latitud_geo unidad="grados">37.7425</latitud_geo>
            <altitud unidad="m">36.0</altitud>
        </punto>
        <punto>
            <distancia_salida unidad="km">75.9</distancia_salida>
            <longitud_geo unidad="grados">-1.2167</longitud_geo>
            <latitud_geo unidad="grados">37.7333</latitud_geo>
            <altitud unidad="m">128.0</altitud>
        </punto>
    </puntos_anonimos>

    <clasificaciones>
        <clasificacion_etapa>
            <clasificado posicion="1">
                <nombre_ciclista>J. Brennan</nombre_ciclista>
                <tiempo_diferencia>03:17:18</tiempo_diferencia>
            </clasificado>
            <clasificado posicion="2">
                <nombre_ciclista>B. Coquard</nombre_ciclista>
                <tiempo_diferencia>+00:00:00</tiempo_diferencia>
            </clasificado>
            <clasificado posicion="3">
                <nombre_ciclista>J. Meeus</nombre_ciclista>
                <tiempo_diferencia>+00:00:00</tiempo_diferencia>
            </clasificado>
        </clasificacion_etapa>

        <clasificacion_general>
            <clasificado posicion="1">
                <nombre_ciclista>J. Brennan</nombre_ciclista>
                <tiempo_diferencia>+00:00:00</tiempo_diferencia>
            </clasificado>
            <clasificado posicion="2">
                <nombre_ciclista>B. Coquard</nombre_ciclista>
                <tiempo_diferencia>+00:00:00</tiempo_diferencia>
            </clasificado>
            <clasificado posicion="3">
                <nombre_ciclista>J. Meeus</nombre_ciclista>
                <tiempo_diferencia>00:00:00</tiempo_diferencia>
            </clasificado>
        </clasificacion_general>

        <clasificacion_equipos>
            <clasificado_equipo posicion="1">
                <nombre_equipo>XDS Astana Team</nombre_equipo>
                <tiempo_diferencia>09:51:54</tiempo_diferencia>
            </clasificado_equipo>
            <clasificado_equipo posicion="2">
                <nombre_equipo>Groupama-FDJ United</nombre_equipo>
                <tiempo_diferencia>+00:00:00</tiempo_diferencia>
            </clasificado_equipo>
            <clasificado_equipo posicion="3">
                <nombre_equipo>Team Visma | Lease a Bike</nombre_equipo>
                <tiempo_diferencia>+00:00:00</tiempo_diferencia>
            </clasificado_equipo>
        </clasificacion_equipos>
    </clasificaciones>

    
</etapa>